{
  "capabilities": [
    {
      "id": "aws.account.audit",
      "support": "partial",
      "targetKinds": ["aws.account"],
      "version": "v1alpha1"
    },
    {
      "id": "aws.iam.constraint",
      "support": "full",
      "targetKinds": ["aws.account"],
      "version": "v1alpha1"
    },
    {
      "id": "gcp.iam.constraint",
      "support": "full",
      "targetKinds": ["gcp.project"],
      "version": "v1alpha1"
    },
    {
      "id": "k8s.workload.pod_security",
      "support": "full",
      "targetKinds": ["k8s.workload"],
      "version": "v1alpha1"
    },
    {
      "id": "local.dev.ensure_workspace",
      "support": "full",
      "targetKinds": ["local.dev"],
      "version": "v1alpha1"
    },
    {
      "id": "local.sandbox.ensure_marker",
      "support": "full",
      "targetKinds": ["local.sandbox", "sandbox"],
      "version": "v1alpha1"
    },
    {
      "id": "repo.branch_protection",
      "support": "full",
      "targetKinds": ["repo.github"],
      "version": "v1alpha1"
    },
    {
      "id": "repo.managed_file",
      "support": "full",
      "targetKinds": ["repo.github"],
      "version": "v1alpha1"
    },
    {
      "id": "repo.security",
      "support": "full",
      "targetKinds": ["repo.github"],
      "version": "v1alpha1"
    },
    {
      "id": "repo.settings",
      "support": "full",
      "targetKinds": ["repo.github"],
      "version": "v1alpha1"
    }
  ],
  "integrations": [
    {
      "capabilities": [
        {"id": "local.sandbox.ensure_marker", "version": "v1alpha1"}
      ],
      "executionSupport": "fake",
      "identity": "local.sandbox.ensure_marker",
      "name": "ensure_marker",
      "origin": "packaged",
      "phases": ["describe", "evidence", "observe", "plan", "validate", "verify"],
      "summary": "Observe, plan, verify, and evidence a local sandbox marker. Execute is refused.",
      "targetKinds": ["local.sandbox", "sandbox"],
      "version": "0.1.0"
    },
    {
      "artifactDigest": "sha256:1cf952cceb4fec8008b42b5a6e12e1f604d24dec37fcbcb7371dfc7eb3a3a35d",
      "capabilities": [
        {"id": "local.sandbox.ensure_marker", "version": "v1alpha1"}
      ],
      "executionSupport": "fake",
      "identity": "local.sandbox.ensure_marker",
      "manifestDigest": "sha256:cde4adf9e5f4c9e0b127cd11e6e977d25857d4a72602702ffe8a57223b05100e",
      "name": "ensure_marker",
      "origin": "github",
      "phases": ["describe", "evidence", "observe", "plan", "validate", "verify"],
      "release": {
        "artifact": "mint_integration_local-0.2.1a1-py3-none-any.whl",
        "commit": "c0fc6e734a2ffbe95508a6cc9183b382d458bcd6",
        "repository": "opsdevcode/mint-integration-local",
        "tag": "v0.2.1-alpha.1",
        "url": "https://github.com/opsdevcode/mint-integration-local/releases/tag/v0.2.1-alpha.1"
      },
      "summary": "GitHub Release wheel for local.sandbox.ensure_marker. Canonical distribution is the prerelease, not PyPI.",
      "targetKinds": ["local.sandbox", "sandbox"],
      "version": "0.1.0"
    },
    {
      "artifactDigest": "sha256:2307ee7cb58229851b42b02408bb7eb5d9ce3b2878153e6b620a8e54a0c9a0e5",
      "capabilities": [
        {"id": "repo.settings", "version": "v1alpha1"}
      ],
      "executionSupport": "fake",
      "identity": "repo.github.plan",
      "manifestDigest": "sha256:1b805a915d950c614c99089942252abbe6d846658afa741b28824330feba41f9",
      "name": "plan",
      "origin": "github",
      "phases": ["describe", "evidence", "observe", "plan", "validate", "verify"],
      "release": {
        "artifact": "mint_integration_github-0.3.0a1-py3-none-any.whl",
        "commit": "53df7396b03c0af5ddf28255d5003cd61e838e97",
        "repository": "opsdevcode/mint-integration-github",
        "tag": "v0.3.0-alpha.1",
        "url": "https://github.com/opsdevcode/mint-integration-github/releases/tag/v0.3.0-alpha.1"
      },
      "summary": "Plan-only GitHub repository settings from a supplied snapshot. Canonical distribution is the GitHub prerelease, not PyPI. Execute is refused.",
      "targetKinds": ["repo.github"],
      "version": "0.1.0"
    }
  ],
  "schema": "mint.catalog-records/v0",
  "targetKinds": [
    {"fields": [["account", "string"], ["region", "string"]], "kind": "aws.account"},
    {"fields": [["project", "string"], ["region", "string"]], "kind": "gcp.project"},
    {"fields": [["name", "string"], ["namespace", "string"]], "kind": "k8s.workload"},
    {"fields": [["workspace", "string"]], "kind": "local.dev"},
    {"fields": [["id", "string"]], "kind": "local.sandbox"},
    {"fields": [["owner", "string"], ["name", "string"]], "kind": "repo.github"},
    {"fields": [["id", "string"]], "kind": "sandbox"}
  ],
  "version": "v0"
}
